{
 "art_seeds": {
  "beams": "7030647911967166160",
  "cars": "6418870725351611361",
  "city.beams": "13439052175344586091",
  "city.build": "8622568390601205243",
  "city.landmark": "7207574820267963591",
  "city.post": "7901791227729473641",
  "city.ring": "2943725991430186773",
  "city.sea": "8109423294838480464",
  "city.streaks": "1923021931431850432",
  "city.zoning": "15472820433952224762",
  "city_fill": "5423665228077894717",
  "cycles": "4073434717245979321",
  "downtown": "7826751731653159218",
  "fauna.tethys": "751107004298153212",
  "flicker": "5464012333054388172",
  "glitch": "3045621127581486275",
  "glows": "17135088784687987702",
  "ground_glow": "16901929072713318129",
  "key_landmark.meridian": "14583748671798311469",
  "landmark.meridian": "387458531938511369",
  "plumes": "7070062164292223448",
  "ring": "6313052695653539288",
  "scene": "7776197885135020236",
  "sky": "9100362917404553401",
  "street_lanes": "685451770938526337",
  "terrain": "13156197530421309045",
  "variance": "7660326726861359909",
  "windows_flicker": "18020525703066403870"
 },
 "decision": {
  "dist": 44.0947,
  "lens": 30.0,
  "loc": [
   12.8306,
   41.3806,
   10.8092
  ],
  "pitch": 13.0,
  "shift_x": 0.0528,
  "shift_y": -0.0065,
  "tgt": [
   -17.55,
   11.0,
   0.89
  ],
  "yaw": -135.0
 },
 "edges": [
  {
   "a": "L1N0",
   "b": "L2N0",
   "path": [
    [
     -21.0,
     29.5,
     0.95
    ],
    [
     -21.0,
     30.0,
     0.95
    ],
    [
     -12.7792,
     21.0,
     4.75
    ],
    [
     -13.2792,
     21.0,
     4.75
    ]
   ],
   "type": "hq"
  },
  {
   "a": "L1N1",
   "b": "L2N1",
   "path": [
    [
     -12.5,
     21.0,
     0.95
    ],
    [
     -12.0,
     21.0,
     0.95
    ],
    [
     -21.0,
     12.7792,
     4.75
    ],
    [
     -21.0,
     13.2792,
     4.75
    ]
   ],
   "type": "hq"
  },
  {
   "a": "L2N0",
   "b": "L3N0",
   "path": [
    [
     -13.2792,
     21.0,
     4.75
    ],
    [
     -12.7792,
     21.0,
     4.75
    ],
    [
     -21.0,
     13.5583,
     8.55
    ],
    [
     -21.0,
     14.0583,
     8.55
    ]
   ],
   "type": "hq"
  },
  {
   "a": "L2N1",
   "b": "L3N1",
   "path": [
    [
     -21.0,
     13.2792,
     4.75
    ],
    [
     -21.0,
     12.7792,
     4.75
    ],
    [
     -28.4417,
     21.0,
     8.55
    ],
    [
     -27.9417,
     21.0,
     8.55
    ]
   ],
   "type": "hq"
  },
  {
   "a": "L3N0",
   "b": "L4N0",
   "path": [
    [
     -21.0,
     14.0583,
     8.55
    ],
    [
     -21.0,
     13.5583,
     8.55
    ],
    [
     -27.6625,
     21.0,
     12.35
    ],
    [
     -27.1625,
     21.0,
     12.35
    ]
   ],
   "type": "hq"
  },
  {
   "a": "L3N1",
   "b": "L4N1",
   "path": [
    [
     -27.9417,
     21.0,
     8.55
    ],
    [
     -28.4417,
     21.0,
     8.55
    ],
    [
     -21.0,
     27.6625,
     12.35
    ],
    [
     -21.0,
     27.1625,
     12.35
    ]
   ],
   "type": "hq"
  },
  {
   "a": "L3N1",
   "b": "L4N2",
   "path": [
    [
     -27.9417,
     21.0,
     8.55
    ],
    [
     -28.4417,
     21.0,
     8.55
    ],
    [
     -14.3375,
     21.0,
     12.35
    ],
    [
     -14.8375,
     21.0,
     12.35
    ]
   ],
   "type": "hq"
  },
  {
   "a": "L4N0",
   "b": "L5N0",
   "path": [
    [
     -27.1625,
     21.0,
     12.35
    ],
    [
     -27.6625,
     21.0,
     12.35
    ],
    [
     -21.0,
     26.8833,
     16.15
    ],
    [
     -21.0,
     26.3833,
     16.15
    ]
   ],
   "type": "hq"
  },
  {
   "a": "L4N1",
   "b": "L5N1",
   "path": [
    [
     -21.0,
     27.1625,
     12.35
    ],
    [
     -21.0,
     27.6625,
     12.35
    ],
    [
     -15.1167,
     21.0,
     16.15
    ],
    [
     -15.6167,
     21.0,
     16.15
    ]
   ],
   "type": "hq"
  },
  {
   "a": "L4N2",
   "b": "L5N2",
   "path": [
    [
     -14.8375,
     21.0,
     12.35
    ],
    [
     -14.3375,
     21.0,
     12.35
    ],
    [
     -21.0,
     15.1167,
     16.15
    ],
    [
     -21.0,
     15.6167,
     16.15
    ]
   ],
   "type": "hq"
  },
  {
   "a": "L4N2",
   "b": "L5N3",
   "path": [
    [
     -14.8375,
     21.0,
     12.35
    ],
    [
     -14.3375,
     21.0,
     12.35
    ],
    [
     -26.8833,
     21.0,
     16.15
    ],
    [
     -26.3833,
     21.0,
     16.15
    ]
   ],
   "type": "hq"
  },
  {
   "a": "L5N0",
   "b": "L6N0",
   "path": [
    [
     -21.0,
     26.3833,
     16.15
    ],
    [
     -21.0,
     26.8833,
     16.15
    ],
    [
     -15.8958,
     21.0,
     19.95
    ],
    [
     -16.3958,
     21.0,
     19.95
    ]
   ],
   "type": "hq"
  },
  {
   "a": "L5N1",
   "b": "L6N1",
   "path": [
    [
     -15.6167,
     21.0,
     16.15
    ],
    [
     -15.1167,
     21.0,
     16.15
    ],
    [
     -21.0,
     15.8958,
     19.95
    ],
    [
     -21.0,
     16.3958,
     19.95
    ]
   ],
   "type": "hq"
  },
  {
   "a": "L5N2",
   "b": "L6N2",
   "path": [
    [
     -21.0,
     15.6167,
     16.15
    ],
    [
     -21.0,
     15.1167,
     16.15
    ],
    [
     -26.1042,
     21.0,
     19.95
    ],
    [
     -25.6042,
     21.0,
     19.95
    ]
   ],
   "type": "hq"
  },
  {
   "a": "L5N3",
   "b": "L6N2",
   "path": [
    [
     -26.3833,
     21.0,
     16.15
    ],
    [
     -26.8833,
     21.0,
     16.15
    ],
    [
     -26.1042,
     21.0,
     19.95
    ],
    [
     -25.6042,
     21.0,
     19.95
    ]
   ],
   "type": "hq"
  },
  {
   "a": "L6N0",
   "b": "L7N0",
   "path": [
    [
     -16.3958,
     21.0,
     19.95
    ],
    [
     -15.8958,
     21.0,
     19.95
    ],
    [
     -21.0,
     16.675,
     23.75
    ],
    [
     -21.0,
     17.175,
     23.75
    ]
   ],
   "type": "hq"
  },
  {
   "a": "L6N1",
   "b": "L7N0",
   "path": [
    [
     -21.0,
     16.3958,
     19.95
    ],
    [
     -21.0,
     15.8958,
     19.95
    ],
    [
     -21.0,
     16.675,
     23.75
    ],
    [
     -21.0,
     17.175,
     23.75
    ]
   ],
   "type": "hq"
  },
  {
   "a": "L6N2",
   "b": "L7N0",
   "path": [
    [
     -25.6042,
     21.0,
     19.95
    ],
    [
     -26.1042,
     21.0,
     19.95
    ],
    [
     -21.0,
     16.675,
     23.75
    ],
    [
     -21.0,
     17.175,
     23.75
    ]
   ],
   "type": "hq"
  }
 ],
 "kind": "hq",
 "layout_seed": "104",
 "overview": {
  "dist": 85.672,
  "lens": 40.0,
  "loc": [
   33.4482,
   75.4482,
   50.8561
  ],
  "pitch": 26.0,
  "shift_x": -0.0729,
  "shift_y": -0.0203,
  "tgt": [
   -21.0,
   21.0,
   13.3
  ],
  "yaw": -135.0
 },
 "rooms": {
  "L1N0": {
   "back": [
    [
     -19.4,
     27.9,
     0.12
    ],
    [
     -22.6,
     27.9,
     0.12
    ],
    [
     -22.6,
     27.9,
     1.78
    ],
    [
     -19.4,
     27.9,
     1.78
    ]
   ],
   "bld": "hq:meridian",
   "floor": 0,
   "front": [
    [
     -19.4,
     29.5,
     0.12
    ],
    [
     -22.6,
     29.5,
     0.12
    ],
    [
     -22.6,
     29.5,
     1.78
    ],
    [
     -19.4,
     29.5,
     1.78
    ]
   ],
   "ground_z": 0.0,
   "kind": "terminal",
   "layer": 1,
   "parts": [
    0
   ],
   "span": 1
  },
  "L1N1": {
   "back": [
    [
     -14.1,
     19.4,
     0.12
    ],
    [
     -14.1,
     22.6,
     0.12
    ],
    [
     -14.1,
     22.6,
     1.78
    ],
    [
     -14.1,
     19.4,
     1.78
    ]
   ],
   "bld": "hq:meridian",
   "floor": 0,
   "front": [
    [
     -12.5,
     19.4,
     0.12
    ],
    [
     -12.5,
     22.6,
     0.12
    ],
    [
     -12.5,
     22.6,
     1.78
    ],
    [
     -12.5,
     19.4,
     1.78
    ]
   ],
   "ground_z": 0.0,
   "kind": "terminal",
   "layer": 1,
   "parts": [
    0
   ],
   "span": 1
  },
  "L2N0": {
   "back": [
    [
     -14.8792,
     19.4,
     3.92
    ],
    [
     -14.8792,
     22.6,
     3.92
    ],
    [
     -14.8792,
     22.6,
     5.58
    ],
    [
     -14.8792,
     19.4,
     5.58
    ]
   ],
   "bld": "hq:meridian",
   "floor": 2,
   "front": [
    [
     -13.2792,
     19.4,
     3.92
    ],
    [
     -13.2792,
     22.6,
     3.92
    ],
    [
     -13.2792,
     22.6,
     5.58
    ],
    [
     -13.2792,
     19.4,
     5.58
    ]
   ],
   "ground_z": 0.0,
   "kind": "terminal",
   "layer": 2,
   "parts": [
    1
   ],
   "span": 1
  },
  "L2N1": {
   "back": [
    [
     -22.6,
     14.8792,
     3.92
    ],
    [
     -19.4,
     14.8792,
     3.92
    ],
    [
     -19.4,
     14.8792,
     5.58
    ],
    [
     -22.6,
     14.8792,
     5.58
    ]
   ],
   "bld": "hq:meridian",
   "floor": 2,
   "front": [
    [
     -22.6,
     13.2792,
     3.92
    ],
    [
     -19.4,
     13.2792,
     3.92
    ],
    [
     -19.4,
     13.2792,
     5.58
    ],
    [
     -22.6,
     13.2792,
     5.58
    ]
   ],
   "ground_z": 0.0,
   "kind": "router",
   "layer": 2,
   "parts": [
    1
   ],
   "span": 1
  },
  "L3N0": {
   "back": [
    [
     -22.6,
     15.6583,
     7.72
    ],
    [
     -19.4,
     15.6583,
     7.72
    ],
    [
     -19.4,
     15.6583,
     9.38
    ],
    [
     -22.6,
     15.6583,
     9.38
    ]
   ],
   "bld": "hq:meridian",
   "floor": 4,
   "front": [
    [
     -22.6,
     14.0583,
     7.72
    ],
    [
     -19.4,
     14.0583,
     7.72
    ],
    [
     -19.4,
     14.0583,
     9.38
    ],
    [
     -22.6,
     14.0583,
     9.38
    ]
   ],
   "ground_z": 0.0,
   "kind": "server_rack",
   "layer": 3,
   "parts": [
    2
   ],
   "span": 1
  },
  "L3N1": {
   "back": [
    [
     -26.3417,
     22.6,
     7.72
    ],
    [
     -26.3417,
     19.4,
     7.72
    ],
    [
     -26.3417,
     19.4,
     9.38
    ],
    [
     -26.3417,
     22.6,
     9.38
    ]
   ],
   "bld": "hq:meridian",
   "floor": 4,
   "front": [
    [
     -27.9417,
     22.6,
     7.72
    ],
    [
     -27.9417,
     19.4,
     7.72
    ],
    [
     -27.9417,
     19.4,
     9.38
    ],
    [
     -27.9417,
     22.6,
     9.38
    ]
   ],
   "ground_z": 0.0,
   "kind": "router",
   "layer": 3,
   "parts": [
    2
   ],
   "span": 1
  },
  "L4N0": {
   "back": [
    [